{
  "$schema": "./project.config.schema.json",
  "schemaVersion": 1,
  "project": {
    "templateName": "AI portfolio website with RAG chat",
    "packageBaseName": "alextym",
    "frontendPackageName": "alextym-frontend",
    "backendPackageName": "alextym-backend",
    "dockerImageName": "alextym-backend",
    "observabilityServiceName": "portfolio-backend"
  },
  "content": {
    "publicResumePath": "content/public/resume.md"
  },
  "owner": {
    "displayName": "Alex Tymoshenko",
    "shortName": "Alex",
    "possessiveName": "Alex's",
    "localizedNames": {
      "russian": "\u0410\u043b\u0435\u043a\u0441\u0435\u0439",
      "ukrainian": "\u041e\u043b\u0435\u043a\u0441\u0456\u0439"
    },
    "roleTitle": "Automation & Integration Engineer",
    "publicAliases": [
      "Alex",
      "Oleksii",
      "Tymoshenko"
    ]
  },
  "site": {
    "name": "alextym.com",
    "canonicalUrl": "https://alextym.com"
  },
  "links": {
    "github": "https://github.com/AlexTymosh",
    "linkedin": "https://www.linkedin.com/in/alex-tim-tech/",
    "facebook": "https://www.facebook.com/ol.tymoshenko"
  },
  "seo": {
    "defaultTitle": "Alex Tymoshenko | Automation Engineer",
    "description": "Automation Engineer focused on BI, data analysis, API integrations, ERP/CRM workflows, and AI-assisted tools that reduce manual work.",
    "shortDescription": "Automation Engineer focused on BI, data analysis, API integrations, ERP/CRM workflows, and AI-assisted tools that reduce manual work.",
    "keywords": [
      "Alex Tymoshenko",
      "Oleksii Tymoshenko",
      "Software Developer",
      "Python Developer",
      "FastAPI",
      "Automation Engineer",
      "API Integration",
      "Business Process Automation",
      "ERP Automation",
      "RAG",
      "AI Portfolio",
      "Basingstoke",
      "UK"
    ],
    "openGraph": {
      "imagePath": "/og-image.png",
      "imageAlt": "Alex Tymoshenko, Automation and Integration Engineer portfolio"
    },
    "jsonLd": {
      "jobTitle": "Automation Engineer",
      "knowsAbout": [
        "Business process automation",
        "API integrations",
        "ERP/CRM workflows",
        "BI Analyst",
        "BI reporting",
        "Data analysis",
        "Data pipelines",
        "AI-assisted internal tools",
        "RAG systems",
        "Python",
        "FastAPI"
      ]
    },
    "pages": {
      "resume": {
        "description": "Resume of Alex (Oleksii) Tymoshenko, Automation Engineer focused on BI, API integrations, ERP/CRM workflows, data analysis, and AI-assisted tools.\n"
      },
      "chat": {
        "description": "Ask Alex Tymoshenko's AI assistant about his CV, automation projects, BI/data analysis, API integrations, ERP/CRM workflows, and potential collaboration."
      },
      "contact": {
        "description": "Contact Alex Tymoshenko about automation projects, BI/data analysis, API integrations, ERP/CRM workflows, AI-assisted tools, job opportunities, or collaboration."
      },
      "disclaimer": {
        "description": "Disclaimer for the portfolio website, AI assistant, contact flow, human handoff, analytics, and monitoring boundaries."
      }
    }
  },
  "home": {
    "profileCard": {
      "name": "Alex Tymoshenko",
      "imageSrc": "/images/profile/alex.webp",
      "imageAlt": "",
      "summary": "Automation Engineer focused on reducing manual work through BI/data analysis, API integrations, ERP/CRM workflow automation, and AI-assisted internal tools.\n"
    },
    "assistantCard": {
      "eyebrow": "AI Profile Chat",
      "title": "Quick questions",
      "description": "\u2728 Save time by asking about my CV, projects, and professional background.",
      "cta": "Ask my AI assistant",
      "href": "/chat"
    },
    "connectCard": {
      "eyebrow": "Connect",
      "linkVisibility": {
        "github": true,
        "linkedin": true,
        "facebook": true
      }
    },
    "projectStackTitle": "Technologies and Focus Areas Behind My Projects",
    "featuredProject": {
      "previewHeading": "Latest Projects in Progress",
      "title": "yourname.com",
      "description": [
        "Build your own AI portfolio website.",
        "I open-sourced this site as a reusable MIT-licensed template. Follow the setup guide, replace the public CV and project content, and make it your own."
      ],
      "cta": "Get the setup guide",
      "href": "https://github.com/AlexTymosh/alextym.com",
      "previewItems": [
        {
          "title": "FastAPI SaaS Template",
          "detail": "GDPR-aware modular backend with tenant access, audit, rate limiting, and API contracts.",
          "href": "https://github.com/AlexTymosh/fastapi-saas-template",
          "slot": "top-left"
        },
        {
          "title": "Job Application AI Assistant",
          "detail": "CV tailoring, ATS-style checks, and evidence-based application support.",
          "href": "https://github.com/AlexTymosh/job-application-assistant",
          "slot": "top-right"
        },
        {
          "title": "alextym.com",
          "detail": "RAG-based AI portfolio with public CV, chat, contact flow, and reusable setup path.",
          "href": "https://github.com/AlexTymosh/alextym.com",
          "slot": "bottom-right"
        }
      ]
    },
    "featuredAutomationDemo": {
      "eyebrow": "Excel API Magic",
      "title": "Excel-based ERP/API Automation Platform",
      "description": "Lightweight internal tool connecting Excel workflows with Odoo ERP, API sync, reporting, structured logging, and user-facing automation.",
      "youtubeVideoId": "uAvHcnk1ym8",
      "youtubeTitle": "Excel API Integration demo",
      "cta": "Open on YouTube"
    },
    "buildFocus": {
      "eyebrow": "Current Engineering Focus",
      "title": "SaaS backend systems with GDPR-aware architecture",
      "description": "Most of my current effort goes into a FastAPI SaaS backend template: a modular monolith for small and medium SaaS products with tenant/platform access control, Keycloak OIDC/JWT, audit and outbox foundations, Redis-backed rate limiting, structured errors, testing, and observability."
    },
    "projectStack": [
      "Python",
      "FastAPI",
      "TypeScript",
      "Next.js",
      "PostgreSQL",
      "Redis",
      "SQLAlchemy",
      "Alembic",
      "Pydantic v2",
      "Keycloak/OIDC",
      "API integrations",
      "RAG",
      "OpenAI API",
      "Qdrant",
      "BI/reporting workflows",
      "Docker",
      "Linux",
      "Prometheus",
      "Grafana"
    ]
  },
  "contact": {
    "heading": {
      "title": "Contact Me",
      "description": ["Contact me about Automation Engineer, Python Developer, ",
        "API Integration, Internal Tools, or AI-assisted workflow automation roles"]
    },
    "socialLinks": ["linkedin", "github", "facebook"],
    "form": {
      "ariaLabel": "Contact form",
      "fields": {
        "name": {
          "label": "Your Name",
          "placeholder": "Your name"
        },
        "email": {
          "label": "Email Address",
          "placeholder": "you@example.com"
        },
        "message": {
          "label": "Message",
          "placeholder": "Tell Alex what you would like to discuss."
        },
        "companyWebsite": {
          "label": "Company Website"
        }
      },
      "submitLabel": "Send Message",
      "sendingLabel": "Sending...",
      "notices": {
        "missingFields": "Please fill in your name, email, and message.",
        "success": "Message sent. Alex will review it.",
        "genericError": "Could not send message.",
        "dailyLimit": "Daily message limit reached. Please try again later.",
        "validationError": "Please check the form fields and try again.",
        "unavailable": "Contact form is temporarily unavailable. Please try again later.",
        "serverError": "Could not send message. Please try again later."
      }
    }
  },
  "chat": {
    "quickPrompts": [
      {
        "label": "Give me Alex's 30-second intro",
        "handoffSuggested": false,
        "handoffReason": null,
        "responses": [
          "Alex is an Automation Engineer with a strong business analysis background.\nHe analyses raw technical data and business processes, genuinely enjoys identifying bottlenecks, and turns them into clear automation solutions with well-defined acceptance criteria.\nHe has a strong understanding of the challenges, limitations and practical realities of modern tools, from Excel dependencies to AI hype.\nHe prefers a S.M.A.R.T. approach to task-setting and follows the Kaizen philosophy: improvement is not a one-off task, but a continuous process guided by clearly defined metrics.\n\nWould you like to see details about his latest work experience?",
          "Alex is an Automation Engineer with a strong understanding of end-to-end workflows.\nHe understands both the technical side of automation and the business context: how processes work, how roles are distributed, where bottlenecks appear, and what limitations exist in ERP systems, AI tools and API integrations.\nHis focus is not simply to implement IT solutions, but to improve operational processes and demonstrate business impact through clear metrics.\n\nWould you like to see details about his latest work experience?",
          "Alex is an Automation Engineer who helps companies improve operational processes through analysis, automation and measurable outcomes.\nHe is able to take a process from analysis through to the implementation of an automation solution, followed by quality control and documentation. Alex works with Python, Excel-to-ERP migration, API integrations, internal tools and AI-assisted automation.\nIn his work, he prefers a S.M.A.R.T. approach.\n\nWould you like to see an example from his most recent work experience?"
        ]
      },
      {
        "label": "What are Alex's main strengths?",
        "handoffSuggested": false,
        "handoffReason": null,